{
  "id": "orb",
  "displayName": {
    "zh-CN": "光球",
    "en": "Orb"
  },
  "recipe": "pose-sprite",
  "packId": "orb-fixture",
  "userSelectable": true,
  "gradePolicy": {
    "showExactLevelNumber": false,
    "showDescription": false,
    "insigniaMode": "none"
  },
  "behavior": {
    "ambientPool": [
      "rest",
      "look-around",
      "look-left",
      "look-right"
    ],
    "stateReactions": {
      "completed": "nod",
      "failed": "shy",
      "working": "nod",
      "needs-input": "peek"
    },
    "petting": {
      "variant": "idle-happy",
      "decoration": "sparkles"
    }
  },
  "license": {
    "license": "Apache-2.0 (code) / CC-BY-4.0 (assets) — see NOTICE and LICENSE.assets",
    "attribution": "Original fixture art generated by the in-repo deterministic pipeline.",
    "provenance": "src/dsh/client/pets/orb/PROVENANCE-orb.json"
  },
  "poseSprite": {
    "variantPose": {
      "idle": 0,
      "idle-happy": 1,
      "idle-curious": 2,
      "idle-sleepy": 3,
      "working": 4,
      "needs-input": 5,
      "completed": 6,
      "completed-proud": 7,
      "failed": 8,
      "cancelled": 9
    },
    "poseSource": {
      "kind": "files",
      "dir": "./assets"
    }
  }
}
